{
  "cells": [
    {
      "compact_artifact_bytes": 26641,
      "compact_copy_gate_pass": true,
      "compact_exact_copies": 0,
      "compact_near_copies": 0,
      "compact_release_safe": false,
      "compact_retention": 0.7253292790653557,
      "compact_within_l3_bytes": false,
      "configuration": "default",
      "dataset": "Adult",
      "difference_dope_minus_compact": 0.10829897668244404,
      "dope_artifact_bytes": 6337,
      "dope_configuration": "q8_symbolic",
      "dope_metric_receipt_sha256": "3ba9c206202081c768ffbc54606fed23b0ffddca5db018f34d87e097b17ac6ae",
      "dope_release_safe": null,
      "dope_retention": 0.8336282557477998,
      "fit_receipt_sha256": "4db9d3e0dfd6dd046d8ab889d54325452a8daa9e43a9c672ea614178ed84eec8",
      "fit_seed": 23,
      "implementation": "study_owned_reference",
      "method": "Chow-Liu",
      "metric_receipt_sha256": "906c93571117b82d3857e7dd6ce59c0879141eb9cd147269af223aa849001ce7",
      "native_objective": "mean_log_density",
      "native_validation_kpi": -3.56256662390151,
      "replay_receipt_sha256": "e2dfdd49b6b4d452a9d82358970ac73cd530a5d42919f3e0a61b118362899a63",
      "sample_attempt_sha256": "2916e41a6dc079af5caa9a4422b7fbcfc2fa8db1387041d00ce52ac08d4d95b7",
      "sample_receipt_sha256": "2916e41a6dc079af5caa9a4422b7fbcfc2fa8db1387041d00ce52ac08d4d95b7",
      "sample_seed": 101,
      "size_multiplier": 1
    },
    {
      "compact_artifact_bytes": 26641,
      "compact_copy_gate_pass": true,
      "compact_exact_copies": 0,
      "compact_near_copies": 0,
      "compact_release_safe": false,
      "compact_retention": 0.728080850695335,
      "compact_within_l3_bytes": false,
      "configuration": "default",
      "dataset": "Adult",
      "difference_dope_minus_compact": 0.09940930831357364,
      "dope_artifact_bytes": 6337,
      "dope_configuration": "q8_symbolic",
      "dope_metric_receipt_sha256": "f2fb3f718160c342a9f238639ea67457c66dcfc5ac312a54763a3c84b2a6b43e",
      "dope_release_safe": null,
      "dope_retention": 0.8274901590089087,
      "fit_receipt_sha256": "4db9d3e0dfd6dd046d8ab889d54325452a8daa9e43a9c672ea614178ed84eec8",
      "fit_seed": 23,
      "implementation": "study_owned_reference",
      "method": "Chow-Liu",
      "metric_receipt_sha256": "4d10386fe1196fb50ec2ef35a10ad0536e3b79668b01e3d7212d6772f931a32a",
      "native_objective": "mean_log_density",
      "native_validation_kpi": -3.56256662390151,
      "replay_receipt_sha256": "b0c07d53d9bcce120af1aab2218fc9caac1c595e8dd742d56174ed6c0f1b7314",
      "sample_attempt_sha256": "2e33d1b78d29fa1267704bcf89d9952a0004a8722d57f20534bb34395566052b",
      "sample_receipt_sha256": "2e33d1b78d29fa1267704bcf89d9952a0004a8722d57f20534bb34395566052b",
      "sample_seed": 211,
      "size_multiplier": 1
    },
    {
      "compact_artifact_bytes": 26641,
      "compact_copy_gate_pass": true,
      "compact_exact_copies": 0,
      "compact_near_copies": 0,
      "compact_release_safe": false,
      "compact_retention": 0.7159520730405033,
      "compact_within_l3_bytes": false,
      "configuration": "default",
      "dataset": "Adult",
      "difference_dope_minus_compact": 0.0997343368628939,
      "dope_artifact_bytes": 6337,
      "dope_configuration": "q8_symbolic",
      "dope_metric_receipt_sha256": "636ed00bc4265d0b714a73e44741fbee6383b7256595e7d18b7fb0b9ccd88b90",
      "dope_release_safe": null,
      "dope_retention": 0.8156864099033972,
      "fit_receipt_sha256": "4db9d3e0dfd6dd046d8ab889d54325452a8daa9e43a9c672ea614178ed84eec8",
      "fit_seed": 23,
      "implementation": "study_owned_reference",
      "method": "Chow-Liu",
      "metric_receipt_sha256": "11fd3b7036192a8ae72a69cde174c6fc86698d32611d752f5d62d40be04e7e8d",
      "native_objective": "mean_log_density",
      "native_validation_kpi": -3.56256662390151,
      "replay_receipt_sha256": "206e6004743ee558444f54bc11f8e7abadca43f5f1e980257a0a56f2f1d897a2",
      "sample_attempt_sha256": "c64140acf6cc0fee5fe7217ad09149ba9e59c160a8511883b7c371175ff52470",
      "sample_receipt_sha256": "c64140acf6cc0fee5fe7217ad09149ba9e59c160a8511883b7c371175ff52470",
      "sample_seed": 307,
      "size_multiplier": 1
    },
    {
      "compact_artifact_bytes": 26641,
      "compact_copy_gate_pass": true,
      "compact_exact_copies": 0,
      "compact_near_copies": 0,
      "compact_release_safe": false,
      "compact_retention": 0.7275204302656417,
      "compact_within_l3_bytes": false,
      "configuration": "default",
      "dataset": "Adult",
      "difference_dope_minus_compact": 0.10174275377415343,
      "dope_artifact_bytes": 6337,
      "dope_configuration": "q8_symbolic",
      "dope_metric_receipt_sha256": "f16d4f354445105abea77242cfc689d03ec1932d2c8b71c23a023a8c0b856cec",
      "dope_release_safe": null,
      "dope_retention": 0.8292631840397952,
      "fit_receipt_sha256": "4db9d3e0dfd6dd046d8ab889d54325452a8daa9e43a9c672ea614178ed84eec8",
      "fit_seed": 23,
      "implementation": "study_owned_reference",
      "method": "Chow-Liu",
      "metric_receipt_sha256": "fb0eea8c1b5b7cdc85c4ecc7b581a9d297b02aec865c67fb3b81c978783c501f",
      "native_objective": "mean_log_density",
      "native_validation_kpi": -3.56256662390151,
      "replay_receipt_sha256": "8d077497f01a98469f6df3c2390bb31fdf1e350b288a9921101bf25a1f79efca",
      "sample_attempt_sha256": "0ddf766868c89a1c1f892765ad6bcda2cdebb1cb277297ef8bf5ca79336f4d1d",
      "sample_receipt_sha256": "0ddf766868c89a1c1f892765ad6bcda2cdebb1cb277297ef8bf5ca79336f4d1d",
      "sample_seed": 101,
      "size_multiplier": 4
    },
    {
      "compact_artifact_bytes": 26641,
      "compact_copy_gate_pass": true,
      "compact_exact_copies": 0,
      "compact_near_copies": 0,
      "compact_release_safe": false,
      "compact_retention": 0.7225089043683203,
      "compact_within_l3_bytes": false,
      "configuration": "default",
      "dataset": "Adult",
      "difference_dope_minus_compact": 0.10594900484846492,
      "dope_artifact_bytes": 6337,
      "dope_configuration": "q8_symbolic",
      "dope_metric_receipt_sha256": "d14c1d8a3cbb03c3dbddbcdbb2248911adf0fd127630a0da60f758ac86ee73b7",
      "dope_release_safe": null,
      "dope_retention": 0.8284579092167852,
      "fit_receipt_sha256": "4db9d3e0dfd6dd046d8ab889d54325452a8daa9e43a9c672ea614178ed84eec8",
      "fit_seed": 23,
      "implementation": "study_owned_reference",
      "method": "Chow-Liu",
      "metric_receipt_sha256": "7abefa74ff173e0d1e0e8346f7df383b244522c03043f74c0b978a38595d5933",
      "native_objective": "mean_log_density",
      "native_validation_kpi": -3.56256662390151,
      "replay_receipt_sha256": "de463a2ce449708ac07af7ec55c3259ab000e6877a7380375c08216b5fe3a8ba",
      "sample_attempt_sha256": "62256798b3b48c79c96f08fe7387a63a2a4717047bde15afe5af70d66ccc9ac4",
      "sample_receipt_sha256": "62256798b3b48c79c96f08fe7387a63a2a4717047bde15afe5af70d66ccc9ac4",
      "sample_seed": 211,
      "size_multiplier": 4
    },
    {
      "compact_artifact_bytes": 26641,
      "compact_copy_gate_pass": true,
      "compact_exact_copies": 0,
      "compact_near_copies": 0,
      "compact_release_safe": false,
      "compact_retention": 0.7309073040619952,
      "compact_within_l3_bytes": false,
      "configuration": "default",
      "dataset": "Adult",
      "difference_dope_minus_compact": 0.09935532526212498,
      "dope_artifact_bytes": 6337,
      "dope_configuration": "q8_symbolic",
      "dope_metric_receipt_sha256": "2b177dd8f49a5f90526a21c5d55459626519b7fdab0d410b4ffd7e48934b01f5",
      "dope_release_safe": null,
      "dope_retention": 0.8302626293241202,
      "fit_receipt_sha256": "4db9d3e0dfd6dd046d8ab889d54325452a8daa9e43a9c672ea614178ed84eec8",
      "fit_seed": 23,
      "implementation": "study_owned_reference",
      "method": "Chow-Liu",
      "metric_receipt_sha256": "793a734425c15a1bf654eee983a09ee2c5aafaed74b9ff38665dbc1f4e0ac19d",
      "native_objective": "mean_log_density",
      "native_validation_kpi": -3.56256662390151,
      "replay_receipt_sha256": "2a613eea3b92bee55cdfecce4ccfea224913c481509af9b742854c4b5c56b299",
      "sample_attempt_sha256": "006284ee1550072c0f50e3623d84947c94fdb6f3119de051b84c0152d8d99dcc",
      "sample_receipt_sha256": "006284ee1550072c0f50e3623d84947c94fdb6f3119de051b84c0152d8d99dcc",
      "sample_seed": 307,
      "size_multiplier": 4
    },
    {
      "compact_artifact_bytes": 108760,
      "compact_copy_gate_pass": false,
      "compact_exact_copies": 0,
      "compact_near_copies": 2,
      "compact_release_safe": false,
      "compact_retention": 0.6694001366133836,
      "compact_within_l3_bytes": false,
      "configuration": "tuned",
      "dataset": "Adult",
      "difference_dope_minus_compact": 0.16422811913441615,
      "dope_artifact_bytes": 6337,
      "dope_configuration": "q8_symbolic",
      "dope_metric_receipt_sha256": "3ba9c206202081c768ffbc54606fed23b0ffddca5db018f34d87e097b17ac6ae",
      "dope_release_safe": null,
      "dope_retention": 0.8336282557477998,
      "fit_receipt_sha256": "08b8e57d531e2421aedb8884cee270dd4681ad2cedbfe6c1a2601170ea4afedc",
      "fit_seed": 23,
      "implementation": "study_owned_reference",
      "method": "Chow-Liu",
      "metric_receipt_sha256": "d866e7fbff7f1d2706ee8848986370dae4c173fe4527eea075498d8989baa00a",
      "native_objective": "mean_log_density",
      "native_validation_kpi": 1.7588367120317336,
      "replay_receipt_sha256": "5a93b1a66215e48dc591976915c5c25b02c4ee7b36bbe376928ef443c847bf5a",
      "sample_attempt_sha256": "253791e14ac3515ae6750d498566a50ee0870a14e6b0d28dc5f0dbac1a8ce61a",
      "sample_receipt_sha256": "253791e14ac3515ae6750d498566a50ee0870a14e6b0d28dc5f0dbac1a8ce61a",
      "sample_seed": 101,
      "size_multiplier": 1
    },
    {
      "compact_artifact_bytes": 108760,
      "compact_copy_gate_pass": true,
      "compact_exact_copies": 0,
      "compact_near_copies": 0,
      "compact_release_safe": false,